{
  "$schema": "https://json-schema.org/draft/2020-12/schema",
  "$id": "https://github.com/NatLabRockies/buildstock-corpus/schemas/index.schema.json",
  "title": "buildstock-corpus release index",
  "description": "Every document and every measure of one dataset release of the corpus, for a consumer that reads the corpus over HTTPS without a clone. Generated by `bsc map`; stamps the manifest it describes.",
  "type": "object",
  "additionalProperties": false,
  "required": ["product", "release", "corpus_version", "manifest_sha256", "sections_file", "counts", "documents", "measures"],
  "properties": {
    "product": { "type": "string", "minLength": 1 },
    "release": { "type": "string", "minLength": 1 },
    "corpus_version": { "type": "string", "minLength": 1, "description": "The build this index describes: a release tag (<release id>-v<N>) or, before the first tag, a commit hash." },
    "manifest_sha256": { "$ref": "#/$defs/sha256" },
    "sections_file": { "type": "string", "const": "sections.json", "description": "Sibling file holding every document's headings and line ranges." },
    "counts": {
      "type": "object",
      "additionalProperties": false,
      "required": ["documents", "measures"],
      "properties": {
        "documents": { "type": "integer", "minimum": 0 },
        "measures": { "type": "integer", "minimum": 0 }
      }
    },
    "documents": {
      "type": "array",
      "items": { "$ref": "#/$defs/document" }
    },
    "measures": {
      "type": "array",
      "items": { "$ref": "#/$defs/measure" }
    }
  },
  "$defs": {
    "sha256": { "type": "string", "pattern": "^[0-9a-f]{64}$" },
    "https_url": { "type": "string", "pattern": "^https://[^\\s]+$" },
    "status": { "type": "string", "enum": ["osti_pdf", "site_page", "missing"] },
    "document": {
      "type": "object",
      "additionalProperties": false,
      "required": ["title", "source_id", "corpus_path", "source_path", "source_url", "publication_url", "status", "bytes", "sections", "sections_dir", "section_files", "chunks", "chunks_file"],
      "properties": {
        "title": { "type": "string" },
        "source_id": { "type": "string", "minLength": 1 },
        "corpus_path": { "type": "string", "pattern": "\\.md$", "description": "Relative to processed/<product>/<release>/." },
        "source_path": { "type": "string", "minLength": 1, "description": "Upstream path or fetched-file path; the citation anchor." },
        "source_url": { "$ref": "#/$defs/https_url", "description": "The upstream file at the commit the corpus was built from, or the OSTI URL." },
        "publication_url": { "$ref": "#/$defs/https_url", "description": "Where a reader is sent for the human-readable form." },
        "status": { "type": "string", "enum": ["osti_pdf", "site_page"] },
        "bytes": { "type": "integer", "minimum": 1, "description": "Size of the processed markdown file." },
        "sections": { "type": "integer", "minimum": 0, "description": "Number of headings; the headings themselves, with levels and line ranges, are in sections.json." },
        "sections_dir": { "type": ["string", "null"], "pattern": "^sections/.+[^/]$", "description": "Directory of this document's section files, relative to processed/<product>/<release>/; null only for a document with none." },
        "section_files": { "type": "array", "items": { "type": "string", "pattern": "^[0-9]{2,}-.*\\.md$" }, "description": "Basenames of this document's section files in document order, one per H2 plus a 00- preamble when the document has text before its first H2. Fetch <sections_dir>/<name>; the slug is the heading." },
        "chunks": { "type": "integer", "minimum": 0, "description": "Number of retrieval chunks cut from this document." },
        "chunks_file": { "type": "string", "pattern": "^chunks/.+\\.jsonl$", "description": "This document's rows of chunks.jsonl as their own JSON Lines file, byte for byte; relative to processed/<product>/<release>/." }
      }
    },
    "measure": {
      "type": "object",
      "additionalProperties": false,
      "required": ["measure_id", "upgrade_id", "upgrade_name", "corpus_path", "doc_url", "status"],
      "properties": {
        "measure_id": { "type": "string", "minLength": 1 },
        "upgrade_id": { "type": ["string", "null"], "description": "The measure's id within this dataset release; null when it is not in the release." },
        "upgrade_name": { "type": ["string", "null"] },
        "corpus_path": { "type": ["string", "null"], "description": "The document that covers this measure, or null for a gap." },
        "doc_url": { "oneOf": [{ "$ref": "#/$defs/https_url" }, { "type": "null" }] },
        "status": { "$ref": "#/$defs/status" }
      }
    }
  }
}
