{"product":"comstock","release":"comstock_amy2018_2025_release_3","corpus_version":"comstock_amy2018_2025_release_3-v3","manifest_sha256":"aaa7a8852ca8337ef90287c2abf3d8575ed625990f3c4c672a24f2c46bc505fa","sections_file":"sections.json","counts":{"documents":118,"measures":65},"documents":[{"title":"Executive Summary","source_id":"technical_reference","corpus_path":"technical_reference/documentation/reference_doc/0_1_exec_summary.md","source_path":"documentation/reference_doc/0_1_exec_summary.tex","source_url":"https://github.com/NatLabRockies/ComStock/blob/b77c60d341c9b68c58c5d51e51b06f08f293d3cb/documentation/reference_doc/0_1_exec_summary.tex","publication_url":"https://natlabrockies.github.io/ComStock.github.io/assets/files/comstock_reference_documentation_2025_3.pdf","status":"site_page","bytes":5627,"sections":2,"sections_dir":"sections/technical_reference/0_1_exec_summary","section_files":["00-executive-summary.md","01-motivation-why-do-we-need-a-commercial-b.md"],"chunks":7,"chunks_file":"chunks/technical_reference/0_1_exec_summary.jsonl"},{"title":"Acknowledgments","source_id":"technical_reference","corpus_path":"technical_reference/documentation/reference_doc/0_2_acknowledgements.md","source_path":"documentation/reference_doc/0_2_acknowledgements.tex","source_url":"https://github.com/NatLabRockies/ComStock/blob/b77c60d341c9b68c58c5d51e51b06f08f293d3cb/documentation/reference_doc/0_2_acknowledgements.tex","publication_url":"https://natlabrockies.github.io/ComStock.github.io/assets/files/comstock_reference_documentation_2025_3.pdf","status":"site_page","bytes":1450,"sections":1,"sections_dir":"sections/technical_reference/0_2_acknowledgements","section_files":["00-acknowledgments.md"],"chunks":1,"chunks_file":"chunks/technical_reference/0_2_acknowledgements.jsonl"},{"title":"List of Acronyms","source_id":"technical_reference","corpus_path":"technical_reference/documentation/reference_doc/0_3_acronyms.md","source_path":"documentation/reference_doc/0_3_acronyms.tex","source_url":"https://github.com/NatLabRockies/ComStock/blob/b77c60d341c9b68c58c5d51e51b06f08f293d3cb/documentation/reference_doc/0_3_acronyms.tex","publication_url":"https://natlabrockies.github.io/ComStock.github.io/assets/files/comstock_reference_documentation_2025_3.pdf","status":"site_page","bytes":1657,"sections":1,"sections_dir":"sections/technical_reference/0_3_acronyms","section_files":["00-list-of-acronyms.md"],"chunks":1,"chunks_file":"chunks/technical_reference/0_3_acronyms.jsonl"},{"title":"Introduction","source_id":"technical_reference","corpus_path":"technical_reference/documentation/reference_doc/1_introduction.md","source_path":"documentation/reference_doc/1_introduction.tex","source_url":"https://github.com/NatLabRockies/ComStock/blob/b77c60d341c9b68c58c5d51e51b06f08f293d3cb/documentation/reference_doc/1_introduction.tex","publication_url":"https://natlabrockies.github.io/ComStock.github.io/assets/files/comstock_reference_documentation_2025_3.pdf","status":"site_page","bytes":5466,"sections":5,"sections_dir":"sections/technical_reference/1_introduction","section_files":["00-introduction.md","01-overview-and-primary-use-applications.md","02-comstock-calibration-and-validation.md","03-comstock-data-access.md","04-changes-since-last-comstock-release.md"],"chunks":6,"chunks_file":"chunks/technical_reference/1_introduction.jsonl"},{"title":"ComStock Workflow","source_id":"technical_reference","corpus_path":"technical_reference/documentation/reference_doc/2_workflow.md","source_path":"documentation/reference_doc/2_workflow.tex","source_url":"https://github.com/NatLabRockies/ComStock/blob/b77c60d341c9b68c58c5d51e51b06f08f293d3cb/documentation/reference_doc/2_workflow.tex","publication_url":"https://natlabrockies.github.io/ComStock.github.io/assets/files/comstock_reference_documentation_2025_3.pdf","status":"site_page","bytes":15439,"sections":8,"sections_dir":"sections/technical_reference/2_workflow","section_files":["00-comstock-workflow.md","01-comstock-sample-definitions.md","02-measures-for-comstock.md","03-openstudio-standards.md","04-comstock-project.md","05-buildstockbatch.md","06-raw-simulation-results.md","07-web-based-visualization-platform.md"],"chunks":18,"chunks_file":"chunks/technical_reference/2_workflow.jsonl"},{"title":"Building Characteristic Sampling","source_id":"technical_reference","corpus_path":"technical_reference/documentation/reference_doc/3_sampling.md","source_path":"documentation/reference_doc/3_sampling.tex","source_url":"https://github.com/NatLabRockies/ComStock/blob/b77c60d341c9b68c58c5d51e51b06f08f293d3cb/documentation/reference_doc/3_sampling.tex","publication_url":"https://natlabrockies.github.io/ComStock.github.io/assets/files/comstock_reference_documentation_2025_3.pdf","status":"site_page","bytes":68107,"sections":16,"sections_dir":"sections/technical_reference/3_sampling","section_files":["00-building-characteristic-sampling.md","01-stock-estimation.md","02-characteristic-estimation.md","03-publication-of-building-characteristic-p.md","04-sampling-methodology.md"],"chunks":68,"chunks_file":"chunks/technical_reference/3_sampling.jsonl"},{"title":"ComStock Building Models","source_id":"technical_reference","corpus_path":"technical_reference/documentation/reference_doc/4_1_introduction.md","source_path":"documentation/reference_doc/4_1_introduction.tex","source_url":"https://github.com/NatLabRockies/ComStock/blob/b77c60d341c9b68c58c5d51e51b06f08f293d3cb/documentation/reference_doc/4_1_introduction.tex","publication_url":"https://natlabrockies.github.io/ComStock.github.io/assets/files/comstock_reference_documentation_2025_3.pdf","status":"site_page","bytes":4347,"sections":1,"sections_dir":"sections/technical_reference/4_1_introduction","section_files":["00-comstock-building-models.md"],"chunks":4,"chunks_file":"chunks/technical_reference/4_1_introduction.jsonl"},{"title":"Location, Type, Age, Space Programming, Energy Code, and Change Over Time","source_id":"technical_reference","corpus_path":"technical_reference/documentation/reference_doc/4_2_meta.md","source_path":"documentation/reference_doc/4_2_meta.tex","source_url":"https://github.com/NatLabRockies/ComStock/blob/b77c60d341c9b68c58c5d51e51b06f08f293d3cb/documentation/reference_doc/4_2_meta.tex","publication_url":"https://natlabrockies.github.io/ComStock.github.io/assets/files/comstock_reference_documentation_2025_3.pdf","status":"site_page","bytes":32522,"sections":16,"sections_dir":"sections/technical_reference/4_2_meta","section_files":["01-location.md","02-building-type.md","03-vintage.md","04-energy-code.md","05-building-system-turnover-and-effective-u.md","06-commercial-refrigeration-equipment.md","07-space-type-ratios.md","08-weather-data.md","09-soil-properties.md"],"chunks":34,"chunks_file":"chunks/technical_reference/4_2_meta.jsonl"},{"title":"Hours of Operation and Occupancy","source_id":"technical_reference","corpus_path":"technical_reference/documentation/reference_doc/4_3_occupancy.md","source_path":"documentation/reference_doc/4_3_occupancy.tex","source_url":"https://github.com/NatLabRockies/ComStock/blob/b77c60d341c9b68c58c5d51e51b06f08f293d3cb/documentation/reference_doc/4_3_occupancy.tex","publication_url":"https://natlabrockies.github.io/ComStock.github.io/assets/files/comstock_reference_documentation_2025_3.pdf","status":"site_page","bytes":15716,"sections":8,"sections_dir":"sections/technical_reference/4_3_occupancy","section_files":["01-hours-of-operation.md","02-occupancy.md"],"chunks":14,"chunks_file":"chunks/technical_reference/4_3_occupancy.jsonl"},{"title":"Geometry","source_id":"technical_reference","corpus_path":"technical_reference/documentation/reference_doc/4_4_geometry.md","source_path":"documentation/reference_doc/4_4_geometry.tex","source_url":"https://github.com/NatLabRockies/ComStock/blob/b77c60d341c9b68c58c5d51e51b06f08f293d3cb/documentation/reference_doc/4_4_geometry.tex","publication_url":"https://natlabrockies.github.io/ComStock.github.io/assets/files/comstock_reference_documentation_2025_3.pdf","status":"site_page","bytes":15900,"sections":10,"sections_dir":"sections/technical_reference/4_4_geometry","section_files":["01-general.md","02-area.md","03-building-shape.md","04-aspect-ratio.md","05-rotation.md","06-floor-height.md","07-number-of-floors.md","08-window-to-wall-ratio-wwr.md","09-space-programming-and-thermal-zoning.md"],"chunks":17,"chunks_file":"chunks/technical_reference/4_4_geometry.jsonl"},{"title":"Envelope","source_id":"technical_reference","corpus_path":"technical_reference/documentation/reference_doc/4_5_envelope.md","source_path":"documentation/reference_doc/4_5_envelope.tex","source_url":"https://github.com/NatLabRockies/ComStock/blob/b77c60d341c9b68c58c5d51e51b06f08f293d3cb/documentation/reference_doc/4_5_envelope.tex","publication_url":"https://natlabrockies.github.io/ComStock.github.io/assets/files/comstock_reference_documentation_2025_3.pdf","status":"site_page","bytes":39516,"sections":20,"sections_dir":"sections/technical_reference/4_5_envelope","section_files":["01-walls.md","02-windows.md","03-roof.md","04-floor.md","05-thermal-bridging.md","06-infiltration-and-natural-ventilation.md"],"chunks":41,"chunks_file":"chunks/technical_reference/4_5_envelope.jsonl"},{"title":"Lighting","source_id":"technical_reference","corpus_path":"technical_reference/documentation/reference_doc/4_6_lighting.md","source_path":"documentation/reference_doc/4_6_lighting.tex","source_url":"https://github.com/NatLabRockies/ComStock/blob/b77c60d341c9b68c58c5d51e51b06f08f293d3cb/documentation/reference_doc/4_6_lighting.tex","publication_url":"https://natlabrockies.github.io/ComStock.github.io/assets/files/comstock_reference_documentation_2025_3.pdf","status":"site_page","bytes":24644,"sections":9,"sections_dir":"sections/technical_reference/4_6_lighting","section_files":["01-interior-lighting.md","02-exterior-lighting.md"],"chunks":28,"chunks_file":"chunks/technical_reference/4_6_lighting.jsonl"},{"tit